{
  "schema_version": 2,
  "id": "proxmox-ve",
  "group": "virtualization",
  "version": "9.2-1",
  "architecture": "x86_64",
  "destination": "images/02-virtualization/proxmox-ve-9.2-1.iso",
  "menu_alias": "Proxmox VE 9.2-1 대화형 설치",
  "description_ko": "가상화 호스트용 대화형 설치기이며 대상 디스크를 직접 확인한다.",
  "description_en": "Interactive virtualization-host installer; verify the destination disk manually.",
  "boot_behavior": "interactive-installer",
  "profile_adapter": "none",
  "source": {
    "kind": "locked-download",
    "filename": "proxmox-ve_9.2-1.iso",
    "url": "https://enterprise.proxmox.com/iso/proxmox-ve_9.2-1.iso",
    "sha256": "4e88fe416df9b527624a175f24c9aa07c714d3332afb1ee3dbf3879573ef2c6c"
  },
  "redistribution": {
    "status": "personal-use-only"
  }
}

