{
  "schema_version": 2,
  "id": "pop-os",
  "group": "desktop",
  "version": "24.04-build-28",
  "architecture": "x86_64",
  "destination": "images/04-desktop/pop-os-24.04-generic-build-28.iso",
  "menu_alias": "Pop!_OS 24.04 한국어 설치",
  "description_ko": "원본 generic ISO를 사용하며 설치 첫 화면에서 한국어를 선택한다.",
  "description_en": "Unmodified generic ISO; select Korean or another language in the installer.",
  "boot_behavior": "interactive-installer",
  "profile_adapter": "none",
  "source": {
    "kind": "locked-download",
    "filename": "pop-os_24.04_amd64_generic_28.iso",
    "url": "https://iso.pop-os.org/24.04/amd64/generic/28/pop-os_24.04_amd64_generic_28.iso",
    "sha256": "8d78e500fc95da765a91cddcf2ab7ba71ce4e7997e4f008456d4d872ee8f8221"
  },
  "redistribution": {
    "status": "personal-use-only"
  }
}

